{
	"$schema": "https://json-schema.org/draft/2020-12/schema",
	"$id": "https://byteowlz.com/schemas/pi-statusline/statusline.schema.json",
	"title": "pi-statusline manifest",
	"description": "Maps pi extension status keys (ctx.ui.setStatus) to styled footer segments. Optional; consumed by the pi-statusline footer extension.",
	"type": "object",
	"properties": {
		"version": {
			"type": "integer"
		},
		"showInactive": {
			"type": "boolean",
			"description": "Render configured items even when no status is published (dimmed standby marker)."
		},
		"icon": {
			"type": "object",
			"description": "Optional leading icon. Omit to show the pi badge image on terminals with Kitty graphics, or the glyph elsewhere.",
			"properties": {
				"glyph": { "type": "string" },
				"fallback": { "type": "string" },
				"color": { "enum": ["accent", "success", "warning", "error", "muted", "dim", "text"] },
				"rows": {
					"type": "integer",
					"description": "Inline badge height in terminal rows (1-2, default 1) on terminals with Kitty graphics."
				},
				"image": {
					"enum": ["auto", "on", "off"],
					"description": "auto (query the terminal for Kitty graphics; glyph inside herdr, tmux, zellij or screen, whose answer does not describe the attached client), on (force the image), off (force the glyph)."
				}
			},
			"additionalProperties": true
		},
		"projectIcon": {
			"type": "boolean",
			"default": true,
			"description": "Show the cwd project's icon (icon/icon_on_dark or icon_on_light, .png or .svg, searched up to the git root) at the right of the pwd line. Needs Kitty graphics."
		},
		"items": {
			"type": "array",
			"items": {
				"type": "object",
				"properties": {
					"id": {
						"type": "string",
						"description": "Stable segment id (defaults to statusKey)."
					},
					"statusKey": {
						"type": "string",
						"description": "The key an extension publishes with ctx.ui.setStatus(key, text)."
					},
					"label": {
						"type": "string",
						"description": "Short prefix shown before the value (defaults to statusKey)."
					},
					"color": {
						"enum": ["accent", "success", "warning", "error", "muted", "dim", "text"],
						"description": "Theme color token for the label."
					},
					"colorValue": {
						"type": "boolean",
						"default": false,
						"description": "Color the published value with the same token as the label (default: only the label is colored)."
					},
					"position": {
						"enum": ["left", "right"],
						"description": "Placement hint for footers that order by position."
					},
					"order": {
						"type": "integer",
						"description": "Sort order (ascending). Default 1000."
					}
				},
				"required": ["statusKey"],
				"additionalProperties": true
			}
		}
	},
	"required": ["items"]
}